{"artifact_hash":"sha256:725fd4f2d396fa11952d8167cc87cfbb2eb3128804814161bd4aad84772f73cd","boot_transition":null,"chain":{"block_hash":"0x8f5dc5b43ed8882c62f2b838d98d38e17fcaaef4351a77cec0952c2bbb766cd0","block_number":43997304,"block_time":1783762896,"chain_id":84532,"contract":"0x0000000000000000000000000000000000000042"},"counter_acknowledgement":{"acknowledged_block_hash":"0x8f5dc5b43ed8882c62f2b838d98d38e17fcaaef4351a77cec0952c2bbb766cd0","acknowledged_block_number":43997304,"baseline":{"oom_kills":0,"queue_corruption_events":0,"worker_restarts":0},"generation":1,"recovery_authorization":null},"counters":{"oom_kills":0,"queue_corruption_events":0,"worker_restarts":0},"observed_at_utc":"2026-07-11T09:41:36Z","prior_artifact_hash":null,"producer":{"boot_id":"4d0e1342-abf3-463b-9c52-93cc04eef297","host_id":"chronos-dgx-spark","queue_id":"p42-dgx-rehearsal"},"queue":{"active_job_count":1,"archive_fault":null,"archive_fault_history":null,"archive_record_count":0,"canonical_byte_headroom":982911,"critical_slack_seconds":900,"earliest_live_deadline":null,"expired_deadline_critical_count":0,"minimum_challenge_slack_seconds":null,"oldest_queued_age_seconds":null,"ordinary_admission_headroom":895,"queue_bytes":129,"queue_hash":"sha256:35b6f0cd78ca331d692e7d05d6b29c017bc80f044d0a1b0f125bf7c325207fc6","queued_job_count":1,"runner_plan":{"concurrency_guard":"green","decision":"wait","host_capacity":"green","max_active_running":1,"swap_guard":"red"},"tombstone_count":0,"urgent_admission_headroom":959,"warning_slack_seconds":3600},"schema_version":"p42-runner-health/v2","sequence":1,"signature":{"algorithm":"ed25519","public_key":"ed25519:84586d88287418366bc877b6a1514ac5caf85ef4c4e121656ae087bb5b585dc4","signature":"ed25519:9c25c21356c2a7e7c993c2445cc2f8d4dd525db8adc3e97a707eab0514807f671ac16b1512dff3cf2386deb5fd0d4a736173be8acf8cd06483334ed6822fc805"}}
