{"artifact_hash":"sha256:719d02ee9c4856c483c32bad9500efb0180ac5b358109882cf7c3d76de8d8052","boot_transition":null,"chain":{"block_hash":"0xba877370932c843c55b639ee639b2458d39be62586b3dbc21d0f993a980adf61","block_number":43998284,"block_time":1783764856,"chain_id":84532,"contract":"0x0000000000000000000000000000000000000042"},"counter_acknowledgement":{"acknowledged_block_hash":"0x8f5dc5b43ed8882c62f2b838d98d38e17fcaaef4351a77cec0952c2bbb766cd0","acknowledged_block_number":43997304,"baseline":{"oom_kills":0,"queue_corruption_events":0,"worker_restarts":0},"generation":1,"recovery_authorization":null},"counters":{"oom_kills":0,"queue_corruption_events":0,"worker_restarts":0},"observed_at_utc":"2026-07-11T10:14:16Z","prior_artifact_hash":"sha256:2e0b89edf1dc33da57fdbf1796332a84154955795565cb748e49108ed5a81417","producer":{"boot_id":"4d0e1342-abf3-463b-9c52-93cc04eef297","host_id":"chronos-dgx-spark","queue_id":"p42-dgx-rehearsal"},"queue":{"active_job_count":1,"archive_fault":null,"archive_fault_history":null,"archive_record_count":0,"canonical_byte_headroom":982911,"critical_slack_seconds":900,"earliest_live_deadline":null,"expired_deadline_critical_count":0,"minimum_challenge_slack_seconds":null,"oldest_queued_age_seconds":null,"ordinary_admission_headroom":895,"queue_bytes":129,"queue_hash":"sha256:35b6f0cd78ca331d692e7d05d6b29c017bc80f044d0a1b0f125bf7c325207fc6","queued_job_count":1,"runner_plan":{"concurrency_guard":"green","decision":"start","host_capacity":"green","max_active_running":1,"swap_guard":"green"},"tombstone_count":0,"urgent_admission_headroom":959,"warning_slack_seconds":3600},"schema_version":"p42-runner-health/v2","sequence":5,"signature":{"algorithm":"ed25519","public_key":"ed25519:84586d88287418366bc877b6a1514ac5caf85ef4c4e121656ae087bb5b585dc4","signature":"ed25519:0f5ffc89d3cc5e00e343c608cf190a9f834ee1045e871b2e0aa57cafdf399231c59120683df26d09d23a77f6bc1b65328ab2ac30a753f70eae4d2c5797feeb0f"}}
